{
  "$schema": "https://json-schema.org/draft/2020-12/schema",
  "$id": "urn:guard-spec:v1:baseline",
  "title": "Guard spec v1 — baseline",
  "description": "Frozen fingerprints of findings that existed when the baseline was taken. A finding whose fingerprint appears here is suppressed up to `count` occurrences; everything else is new and gates. Only non-passing verdicts are ever fingerprinted.",
  "type": "object",
  "required": ["schemaVersion", "tool", "createdAt", "fingerprints"],
  "properties": {
    "$schema": { "type": "string" },
    "schemaVersion": { "const": 1 },
    "tool": { "$ref": "urn:guard-spec:v1:common#/$defs/tool" },
    "createdAt": { "$ref": "urn:guard-spec:v1:common#/$defs/isoDateTime" },
    "head": { "$ref": "urn:guard-spec:v1:common#/$defs/gitSha" },
    "fingerprints": {
      "type": "object",
      "propertyNames": { "pattern": "^[a-f0-9]{64}$" },
      "additionalProperties": { "type": "integer", "minimum": 1 }
    }
  },
  "additionalProperties": false
}
