{
  "schemaVersion": 1,
  "tool": {
    "name": "testguard",
    "version": "0.1.0"
  },
  "createdAt": "2026-09-17T02:00:00Z",
  "head": "deadbeefcafe",
  "fingerprints": {
    "01876384493be6809da455cb1a1c4bc92e7564e9898506d790b9589200502163": 1,
    "0a0767ff8b124883e0bc042094c8494027b3d6d45bb8f4e40eda0930214a8970": 1
  }
}
